{
  "$schema": "./schema.json",
  "schemaVersion": 1,
  "id": "jcb",
  "title": "Joomla Component Builder",
  "description": "Build Joomla components with JCB and its complete companion plugin package.",
  "joomla": [
    "5",
    "6"
  ],
  "configuration": {
    "siteName": "Joomla Component Builder Playground",
    "initialPath": "/administrator/index.php?option=com_componentbuilder"
  },
  "variants": {
    "5": {
      "extensions": [
        {
          "url": "https://github.com/joomengine/pkg-component-builder/archive/refs/tags/v5.2.0.zip",
          "sha256": "261e11de61a31ce6183fdcdf35fd3fdc7d0ff93b347bfb4cdaf7d4c66f93385b"
        }
      ]
    },
    "6": {
      "extensions": [
        {
          "url": "https://github.com/joomengine/pkg-component-builder/archive/refs/tags/v6.2.0.zip",
          "sha256": "17a2b4c7b352d0ead2592e7e5838ace8255bbcbdc71566d883e8e82ca3dacd8e"
        }
      ]
    }
  }
}
