{
  "$schema": "./schema.json",
  "schemaVersion": 1,
  "id": "weblinks",
  "title": "Weblinks",
  "description": "Manage a directory of links with the official Joomla Weblinks component and companion extensions.",
  "joomla": [
    "5",
    "6"
  ],
  "configuration": {
    "siteName": "Joomla Weblinks",
    "initialPath": "/administrator/index.php?option=com_weblinks",
    "extensions": [
      {
        "url": "https://github.com/joomla-extensions/weblinks/releases/download/5.2.0/pkg-weblinks-5.2.0.zip",
        "sha256": "3f5a0081d64b857729711107d54fab6613f0b1e8c5c211a301972c29e42639ad"
      }
    ]
  }
}
